{
  "schema_version": "6.3-candidate",
  "meta_type": "DerivedView",
  "project_id": "P-LFEN-SKILLS",
  "view_id": "DV-RUNTIME-ONLY-NORM-AUDIT-JSON",
  "view_kind": "norm-consistency-audit-json",
  "legacy_kind": null,
  "generated_at": "2026-10-23T11:20:05.603474Z",
  "generator": "run-governed-product-workflow/scripts/governance_artifacts.py",
  "source_snapshot": "b2a1af7057c4d56d0479242abc5b466f3b897c90f69324798c10aaaea921e0dd",
  "sources": [
    "skills/product-engineering/run-governed-product-workflow/assets/runtime/embedded-manifest.json",
    "skills/product-engineering/run-governed-product-workflow/assets/runtime/evaluations/norm-retrieval-budgets.json",
    "skills/product-engineering/run-governed-product-workflow/assets/runtime/evaluations/norm-retrieval-gold.json",
    "skills/product-engineering/run-governed-product-workflow/assets/runtime/mappings/norm-action-taxonomy.json",
    "skills/product-engineering/run-governed-product-workflow/assets/runtime/mappings/profile-meta-map.json",
    "skills/product-engineering/run-governed-product-workflow/assets/runtime/mappings/tailoring-applicability-map.json",
    "skills/product-engineering/run-governed-product-workflow/assets/runtime/norms/01_治理基线/Vibe_Coding_P2裁剪与扩展规范适用性决议_V6.3.md",
    "skills/product-engineering/run-governed-product-workflow/assets/runtime/norms/01_治理基线/Vibe_Coding_任务类型裁剪与统一执行流程规范_V6.3.md",
    "skills/product-engineering/run-governed-product-workflow/assets/runtime/norms/01_治理基线/Vibe_Coding_公共术语与规范性用语基线_V6.3.md",
    "skills/product-engineering/run-governed-product-workflow/assets/runtime/norms/01_治理基线/Vibe_Coding_受控产物目录与状态模型_V6.3.md",
    "skills/product-engineering/run-governed-product-workflow/assets/runtime/norms/02_核心规范/C01_Product_Discovery_Evidence_and_Intent_Standard.md",
    "skills/product-engineering/run-governed-product-workflow/assets/runtime/norms/02_核心规范/C02_Initiative_and_Scope_Standard.md",
    "skills/product-engineering/run-governed-product-workflow/assets/runtime/norms/02_核心规范/C03_PRD_and_Feature_Standard.md",
    "skills/product-engineering/run-governed-product-workflow/assets/runtime/norms/02_核心规范/C04_Atomic_Requirement_and_Evolution_Standard.md",
    "skills/product-engineering/run-governed-product-workflow/assets/runtime/norms/02_核心规范/C05_Acceptance_Verification_and_Validation_Standard.md",
    "skills/product-engineering/run-governed-product-workflow/assets/runtime/norms/02_核心规范/C06_UX_and_Technical_Design_Standard.md",
    "skills/product-engineering/run-governed-product-workflow/assets/runtime/norms/02_核心规范/C07_Human_Agent_Collaboration_Standard.md",
    "skills/product-engineering/run-governed-product-workflow/assets/runtime/norms/02_核心规范/C08_Agent_Context_Governance_Standard.md",
    "skills/product-engineering/run-governed-product-workflow/assets/runtime/norms/02_核心规范/C09_Agent_Execution_and_Evidence_Standard.md",
    "skills/product-engineering/run-governed-product-workflow/assets/runtime/norms/02_核心规范/C10_Decision_Traceability_and_Lineage_Standard.md",
    "skills/product-engineering/run-governed-product-workflow/assets/runtime/norms/02_核心规范/C11_Configuration_Version_Baseline_and_Change_Standard.md",
    "skills/product-engineering/run-governed-product-workflow/assets/runtime/norms/02_核心规范/C12_Review_Quality_Gate_and_Product_Health_Standard.md",
    "skills/product-engineering/run-governed-product-workflow/assets/runtime/norms/03_扩展规范/E01_Architecture_Governance_Extension_Standard.md",
    "skills/product-engineering/run-governed-product-workflow/assets/runtime/norms/03_扩展规范/E02_Security_Privacy_and_Compliance_Extension_Standard.md",
    "skills/product-engineering/run-governed-product-workflow/assets/runtime/norms/03_扩展规范/E03_Data_and_AI_Data_Governance_Extension_Standard.md",
    "skills/product-engineering/run-governed-product-workflow/assets/runtime/norms/03_扩展规范/E04_Knowledge_and_Records_Governance_Extension_Standard.md",
    "skills/product-engineering/run-governed-product-workflow/assets/runtime/norms/03_扩展规范/E05_Product_Operations_and_Service_Management_Extension_Standard.md",
    "skills/product-engineering/run-governed-product-workflow/assets/runtime/norms/05_记录与登记册/V6.3_跨规范产物归属索引.md",
    "skills/product-engineering/run-governed-product-workflow/assets/runtime/schemas/authority-asset.schema.json",
    "skills/product-engineering/run-governed-product-workflow/assets/runtime/schemas/derived-view.schema.json",
    "skills/product-engineering/run-governed-product-workflow/assets/runtime/schemas/minimal-task-record.schema.json",
    "skills/product-engineering/run-governed-product-workflow/assets/runtime/schemas/norm-consistency-report.schema.json",
    "skills/product-engineering/run-governed-product-workflow/assets/runtime/schemas/norm-index-metadata.schema.json",
    "skills/product-engineering/run-governed-product-workflow/assets/runtime/schemas/norm-query-result.schema.json",
    "skills/product-engineering/run-governed-product-workflow/assets/runtime/schemas/norm-query.schema.json",
    "skills/product-engineering/run-governed-product-workflow/assets/runtime/schemas/project-state.schema.json",
    "skills/product-engineering/run-governed-product-workflow/assets/runtime/schemas/run-event.schema.json",
    "skills/product-engineering/run-governed-product-workflow/assets/runtime/schemas/task-after.schema.json",
    "skills/product-engineering/run-governed-product-workflow/assets/runtime/schemas/task-before.schema.json"
  ],
  "content_ref": ".project-governance/tasks/T-ADVERSARIAL-20261023-003/evidence/runtime-consistency/norm-consistency-audit.json",
  "integrity_status": "Complete"
}
