{
  "schema_version": "6.3-candidate",
  "meta_type": "DerivedView",
  "project_id": "P-LFEN-SKILLS",
  "view_id": "DV-RUNTIME-ONLY-NORM-AUDIT-MD",
  "view_kind": "norm-consistency-audit-review",
  "legacy_kind": null,
  "generated_at": "2026-10-23T14:21:30.159555Z",
  "generator": "run-governed-product-workflow/scripts/governance_artifacts.py",
  "source_snapshot": "50b87bc8edd50111238bedb3df686e7ecf44dab16fe75c0538bcda17ed93a0ec",
  "sources": [
    ".project-governance/tasks/T-ADVERSARIAL-20261023-006/evidence/runtime-consistency/norm-consistency-audit.json"
  ],
  "content_ref": ".project-governance/tasks/T-ADVERSARIAL-20261023-006/evidence/runtime-consistency/norm-consistency-audit.md",
  "integrity_status": "Complete"
}
