{
  "schema_version": "6.3-candidate",
  "meta_type": "DerivedView",
  "project_id": "P-AINATIVE-SPEC",
  "view_id": "DV-RUNTIME-ONLY-NORM-AUDIT-MD",
  "view_kind": "norm-consistency-audit-review",
  "legacy_kind": null,
  "generated_at": "2026-10-23T09:27:29.099987Z",
  "generator": "run-governed-product-workflow/scripts/governance_artifacts.py",
  "source_snapshot": "92f0bd3523cb500bd2d49df2cdbc27e4ffcb441fc1010d05fe940a0a09ee317e",
  "sources": [
    ".project-governance/tasks/T-ADVERSARIAL-20261023-001/evidence/runtime-consistency/norm-consistency-audit.json"
  ],
  "content_ref": ".project-governance/tasks/T-ADVERSARIAL-20261023-001/evidence/runtime-consistency/norm-consistency-audit.md",
  "integrity_status": "Complete"
}
